worst_symptom,CA,CH,DE,GB,NL,US
"Because of the tinnitus I am more irritable with my family, friends and colleagues.",0.0,0.02631578947368421,0.0648854961832061,0.029850746268656716,0.05142857142857143,0.0595903165735568
Because of the tinnitus I am more sensitive to environmental noises.,0.11570247933884298,0.12280701754385964,0.09541984732824428,0.04477611940298507,0.06857142857142857,0.08007448789571694
Because of the tinnitus it is difficult to concentrate.,0.11570247933884298,0.06140350877192982,0.12595419847328243,0.06965174129353234,0.13714285714285715,0.15456238361266295
"Because of the tinnitus it is difficult to follow a conversation, a piece of music or a film.",0.10743801652892562,0.11403508771929824,0.14045801526717558,0.14427860696517414,0.09714285714285714,0.1601489757914339
Because of the tinnitus it is hard for me to get to sleep.,0.09917355371900827,0.10526315789473684,0.10610687022900764,0.16417910447761194,0.08571428571428572,0.1378026070763501
I am feeling depressed because of the tinnitus.,0.08264462809917356,0.10526315789473684,0.07786259541984733,0.18407960199004975,0.14285714285714285,0.09683426443202979
I don't have any of these symptoms.,0.12396694214876033,0.20175438596491227,0.10458015267175573,0.04975124378109453,0.06285714285714286,0.08193668528864059
I find it harder to relax because of the tinnitus.,0.256198347107438,0.19298245614035087,0.17480916030534352,0.21890547263681592,0.21714285714285714,0.14152700186219738
I have strong worries because of the tinnitus.,0.09917355371900827,0.07017543859649122,0.1099236641221374,0.0945273631840796,0.13714285714285715,0.08752327746741155
